{
  "walletAddress": "0x60F6D524B036197697819b10c68432e8ACC6977a",
  "createdAt": "2025-10-25T19:51:24.435Z",
  "lastActive": "2025-10-25T19:51:24.435Z",
  "points": {
    "gamingHub": {
      "blockchainBasics": 0,
      "smartContracts": 0,
      "defiProtocols": 0,
      "nftsWeb3": 0
    },
    "storyMode": {
      "chaptersCompleted": 1,
      "totalScore": 1
    },
    "achievements": {
      "firstQuest": true,
      "cryptoNovice": false,
      "blockchainExplorer": false,
      "defiMaster": false,
      "speedLearner": false,
      "perfectionist": false
    },
    "total": 1
  },
  "progress": {
    "completedNodes": [],
    "currentQuest": null,
    "level": 1,
    "xp": 10
  },
  "settings": {
    "autoSync": true,
    "notifications": true
  }
}