{
  "walletAddress": "0x5BD5b7AA359f37244A2f835bf913606eabA5906e",
  "createdAt": "2025-10-24T18:55:00.848Z",
  "lastActive": "2025-10-24T18:55:01.190Z",
  "points": {
    "gamingHub": {
      "blockchainBasics": 6.5,
      "smartContracts": 0,
      "defiProtocols": 0,
      "nftsWeb3": 0
    },
    "storyMode": {
      "chaptersCompleted": 3,
      "totalScore": 3
    },
    "achievements": {
      "firstQuest": true,
      "cryptoNovice": true,
      "blockchainExplorer": false,
      "defiMaster": false,
      "speedLearner": false,
      "perfectionist": false
    },
    "total": 9.5
  },
  "progress": {
    "completedNodes": [
      "quest-started-blockchain-basics",
      "blockchain-basics-challenge-0",
      "blockchain-basics-challenge-1",
      "blockchain-basics-challenge-2",
      "blockchain-basics-challenge-3",
      "blockchain-basics-challenge-4",
      "blockchain-basics-challenge-5",
      "blockchain-basics-challenge-6",
      "blockchain-basics-challenge-7",
      "blockchain-basics-challenge-8",
      "blockchain-basics-challenge-9",
      "blockchain-basics-quest-completed",
      "blockchain-basics-completed",
      "quest-started-crypto-security"
    ],
    "currentQuest": null,
    "level": 1,
    "xp": 95
  },
  "settings": {
    "autoSync": true,
    "notifications": true
  }
}