{
  "walletAddress": "0x742d35CC6634C0532925a3b8D4301d13DC8C2E15",
  "createdAt": "2025-10-20T10:30:00.000Z",
  "lastActive": "2025-10-20T15:45:30.000Z",
  "points": {
    "gamingHub": {
      "blockchainBasics": 8.5,
      "smartContracts": 3.0,
      "defiProtocols": 0,
      "nftsWeb3": 0
    },
    "storyMode": {
      "chaptersCompleted": 2,
      "totalScore": 150
    },
    "achievements": {
      "firstQuest": true,
      "cryptoNovice": true,
      "blockchainExplorer": false,
      "defiMaster": false,
      "speedLearner": false,
      "perfectionist": false
    },
    "total": 161.5
  },
  "progress": {
    "completedNodes": [
      "quest-started-blockchain-basics",
      "blockchain-basics-challenge-0",
      "blockchain-basics-challenge-1",
      "blockchain-basics-challenge-2",
      "blockchain-basics-challenge-3",
      "blockchain-basics-challenge-4",
      "blockchain-basics-challenge-5",
      "blockchain-basics-challenge-6",
      "blockchain-basics-challenge-7",
      "blockchain-basics-challenge-8",
      "blockchain-basics-challenge-9",
      "blockchain-basics-quest-completed",
      "blockchain-basics-completed",
      "quest-started-crypto-security",
      "crypto-security-challenge-0",
      "crypto-security-challenge-1",
      "crypto-security-challenge-2"
    ],
    "currentQuest": "crypto-security",
    "level": 3,
    "xp": 285
  },
  "settings": {
    "autoSync": true,
    "notifications": true
  }
}