{
  "walletAddress": "0xa72D2E0448278090F4d27D55489Fb8C0B261d098",
  "createdAt": "2025-10-29T18:27:53.538Z",
  "lastActive": "2025-10-29T18:27:53.538Z",
  "points": {
    "gamingHub": {
      "blockchainBasics": 0.5,
      "smartContracts": 0,
      "defiProtocols": 0,
      "nftsWeb3": 0
    },
    "storyMode": {
      "chaptersCompleted": 0,
      "totalScore": 0
    },
    "achievements": {
      "firstQuest": true,
      "cryptoNovice": false,
      "blockchainExplorer": false,
      "defiMaster": false,
      "speedLearner": false,
      "perfectionist": false
    },
    "total": 0.5
  },
  "progress": {
    "completedNodes": [
      "quest-started-blockchain-basics",
      "blockchain-basics-challenge-0"
    ],
    "currentQuest": null,
    "level": 1,
    "xp": 5
  },
  "settings": {
    "autoSync": true,
    "notifications": true
  }
}