{
  "walletAddress": "0x1234567890ABCDEF1234567890ABCDEF12345678",
  "createdAt": "2025-10-23T23:55:38.220Z",
  "lastActive": "2025-10-23T23:55:38.227Z",
  "points": {
    "gamingHub": {
      "blockchainBasics": 10,
      "smartContracts": 5,
      "defiProtocols": 3,
      "nftsWeb3": 2
    },
    "storyMode": {
      "chaptersCompleted": 2,
      "totalScore": 30
    },
    "achievements": {
      "firstQuest": true,
      "cryptoNovice": true,
      "blockchainExplorer": false,
      "defiMaster": false,
      "speedLearner": false,
      "perfectionist": false
    },
    "total": 50
  },
  "progress": {
    "completedNodes": [
      "intro"
    ],
    "currentQuest": "blockchain-basics",
    "level": 5,
    "xp": 500
  },
  "settings": {
    "autoSync": true,
    "notifications": true
  }
}